{
  "$schema": "../desktop-theme.schema.json",
  "name": "Catppuccin Macchiato",
  "id": "catppuccin-macchiato",
  "light": {
    "palette": {
      "neutral": "#eff1f5",
      "ink": "#4c4f69",
      "primary": "#7287fd",
      "accent": "#d20f39",
      "success": "#40a02b",
      "warning": "#df8e1d",
      "error": "#d20f39",
      "info": "#04a5e5",
      "diffAdd": "#40a02b",
      "diffDelete": "#d20f39"
    },
    "overrides": {
      "syntax-comment": "#6c6f85",
      "syntax-keyword": "#8839ef",
      "syntax-primitive": "#1e66f5",
      "syntax-constant": "#fe640b"
    }
  },
  "dark": {
    "palette": {
      "neutral": "#24273a",
      "ink": "#cad3f5",
      "primary": "#8aadf4",
      "accent": "#f5bde6",
      "success": "#a6da95",
      "warning": "#eed49f",
      "error": "#ed8796",
      "info": "#8bd5ca"
    },
    "overrides": {
      "text-weak": "#b8c0e0",
      "syntax-comment": "#939ab7",
      "syntax-keyword": "#c6a0f6",
      "syntax-string": "#a6da95",
      "syntax-primitive": "#8aadf4",
      "syntax-variable": "#ed8796",
      "syntax-property": "#91d7e3",
      "syntax-type": "#eed49f",
      "syntax-constant": "#f5a97f",
      "syntax-operator": "#91d7e3",
      "syntax-punctuation": "#cad3f5",
      "syntax-object": "#ed8796",
      "markdown-heading": "#c6a0f6",
      "markdown-text": "#cad3f5",
      "markdown-link": "#8aadf4",
      "markdown-link-text": "#91d7e3",
      "markdown-code": "#a6da95",
      "markdown-block-quote": "#eed49f",
      "markdown-emph": "#eed49f",
      "markdown-strong": "#f5a97f",
      "markdown-horizontal-rule": "#a5adcb",
      "markdown-list-item": "#8aadf4",
      "markdown-list-enumeration": "#91d7e3",
      "markdown-image": "#8aadf4",
      "markdown-image-text": "#91d7e3",
      "markdown-code-block": "#cad3f5"
    }
  }
}
