{
  "$schema": "../desktop-theme.schema.json",
  "name": "Catppuccin Frappe",
  "id": "catppuccin-frappe",
  "light": {
    "palette": {
      "neutral": "#eff1f5",
      "ink": "#4c4f69",
      "primary": "#7287fd",
      "accent": "#d20f39",
      "success": "#40a02b",
      "warning": "#df8e1d",
      "error": "#d20f39",
      "info": "#04a5e5",
      "diffAdd": "#40a02b",
      "diffDelete": "#d20f39"
    },
    "overrides": {
      "syntax-comment": "#6c6f85",
      "syntax-keyword": "#8839ef",
      "syntax-primitive": "#1e66f5",
      "syntax-constant": "#fe640b"
    }
  },
  "dark": {
    "palette": {
      "neutral": "#303446",
      "ink": "#c6d0f5",
      "primary": "#8caaee",
      "accent": "#f4b8e4",
      "success": "#a6d189",
      "warning": "#e5c890",
      "error": "#e78284",
      "info": "#81c8be"
    },
    "overrides": {
      "text-weak": "#b5bfe2",
      "syntax-comment": "#949cbb",
      "syntax-keyword": "#ca9ee6",
      "syntax-string": "#a6d189",
      "syntax-primitive": "#8caaee",
      "syntax-variable": "#e78284",
      "syntax-property": "#99d1db",
      "syntax-type": "#e5c890",
      "syntax-constant": "#ef9f76",
      "syntax-operator": "#99d1db",
      "syntax-punctuation": "#c6d0f5",
      "syntax-object": "#e78284",
      "markdown-heading": "#ca9ee6",
      "markdown-text": "#c6d0f5",
      "markdown-link": "#8caaee",
      "markdown-link-text": "#99d1db",
      "markdown-code": "#a6d189",
      "markdown-block-quote": "#e5c890",
      "markdown-emph": "#e5c890",
      "markdown-strong": "#ef9f76",
      "markdown-horizontal-rule": "#a5adce",
      "markdown-list-item": "#8caaee",
      "markdown-list-enumeration": "#99d1db",
      "markdown-image": "#8caaee",
      "markdown-image-text": "#99d1db",
      "markdown-code-block": "#c6d0f5"
    }
  }
}
